{
  "artifact_contract": {
    "schema_id": "https://rootcellar.dev/schemas/artifacts/v1/batch-dashboard-adapter-exports.schema.json",
    "schema_version": "1.0.0",
    "compatibility": "backward-additive"
  },
  "adapter_exports_version": 1,
  "generated_at": "2026-03-01T01:02:37.733666+00:00",
  "status": "pass",
  "highest_severity": "info",
  "incident_adapter": {
    "event_type": "rootcellar.batch.alert_policy",
    "routing_key": "rootcellar.batch.throughput.policy",
    "status": "pass",
    "severity": "info",
    "summary": "Nightly batch policy checks passing",
    "breach_count": 0,
    "owner_teams": [],
    "owner_targets": [],
    "breaches": [],
    "escalations": [],
    "artifact_refs": {
      "policy": "ci-batch-alert-policy-pass-v1.json",
      "dashboard_pack": "ci-batch-dashboard-pack-pass-v1.json",
      "escalation": "ci-batch-policy-escalation-pass-v2.json"
    }
  },
  "dashboard_adapter": {
    "dataset": "rootcellar.batch.nightly",
    "status": "pass",
    "severity": "info",
    "headline_metrics": {
      "processed_files": 32,
      "failure_count": 0,
      "throughput_files_per_sec": 320.0,
      "dispatch_delivered_route_count": 2,
      "dispatch_failed_route_count": 0,
      "ack_lookup_count": 2,
      "correlation_lookup_count": 2,
      "policy_breach_count": 0
    },
    "policy_checks": [
      {
        "id": "snapshot.status.pass",
        "title": "Snapshot status is pass",
        "severity": "p3",
        "status": "pass",
        "observed": "pass",
        "expected": "pass",
        "source": "snapshot",
        "message": "Throughput snapshot must remain within thresholds."
      },
      {
        "id": "dispatch.failed_routes.max",
        "title": "Dispatch failed routes within threshold",
        "severity": "p2",
        "status": "pass",
        "observed": 0,
        "expected": {
          "max": 0
        },
        "source": "dispatch",
        "message": "Failed dispatch routes indicate downstream delivery reliability risk."
      },
      {
        "id": "dispatch.ack_missing.max",
        "title": "Ack-missing routes within threshold",
        "severity": "p2",
        "status": "pass",
        "observed": 0,
        "expected": {
          "max": 0
        },
        "source": "dispatch",
        "message": "Missing required acknowledgements reduce delivery traceability confidence."
      },
      {
        "id": "dispatch.correlation_mismatch.max",
        "title": "Correlation mismatch routes within threshold",
        "severity": "p2",
        "status": "pass",
        "observed": 0,
        "expected": {
          "max": 0
        },
        "source": "dispatch",
        "message": "Correlation mismatches prevent deterministic cross-system trace joins."
      },
      {
        "id": "dispatch.replay_metadata.required",
        "title": "Replay metadata present on delivered routes",
        "severity": "p2",
        "status": "pass",
        "observed": 0,
        "expected": {
          "missing_allowed": 0
        },
        "source": "dispatch",
        "message": "Replay timestamp/nonce/window fields must be present for delivered routes."
      },
      {
        "id": "ack_retention.lookup_coverage.required",
        "title": "Ack retention lookup covers acknowledged routes",
        "severity": "p2",
        "status": "pass",
        "observed": {
          "ack_received_route_count": 2,
          "ack_lookup_count": 2
        },
        "expected": "ack_lookup_count >= ack_received_route_count",
        "source": "ack_retention_index",
        "message": "Retention lookup count should cover all acknowledged routes."
      },
      {
        "id": "ack_retention.status.valid",
        "title": "Ack retention index status valid",
        "severity": "p2",
        "status": "pass",
        "observed": "ok",
        "expected": "ok|no_ack_records|no_routes",
        "source": "ack_retention_index",
        "message": "Ack retention index should not report degraded dispatch availability when dispatch ran."
      }
    ],
    "metric_points": [
      {
        "metric": "processed_files",
        "value": 32
      },
      {
        "metric": "failure_count",
        "value": 0
      },
      {
        "metric": "throughput_files_per_sec",
        "value": 320.0
      },
      {
        "metric": "dispatch_failed_route_count",
        "value": 0
      },
      {
        "metric": "policy_breach_count",
        "value": 0
      }
    ],
    "dimensions": {
      "routing_key": "rootcellar.batch.throughput.policy",
      "owner_team_default": "rootcellar-core"
    },
    "artifact_refs": {
      "dashboard_pack": "ci-batch-dashboard-pack-pass-v1.json",
      "policy": "ci-batch-alert-policy-pass-v1.json"
    }
  },
  "issues": []
}